{
  "$id": "@karrotframe/pathfinder",
  "$schema": "http://json-schema.org/draft-07/schema#",
  "description": "validator for json schema",
  "type": "object",
  "properties": {
    "name": {
      "type": "string"
    },
    "description": {
      "type": "string"
    },
    "author": {
      "type": "string"
    },
    "endpoint": {
      "type": "string"
    },
    "endpoints": {
      "type": "object",
      "additionalProperties": {
        "type": "string"
      }
    },
    "version": {
      "type": "number"
    },
    "routes": {
      "type": "array",
      "minItems": 1,
      "items": {
        "type": "object",
        "properties": {
          "name": {
            "type": "string"
          },
          "path": {
            "type": "string"
          },
          "description": {
            "type": "string"
          }
        },
        "additionalProperties": {
          "type": "object"
        },
        "required": ["name", "path"]
      }
    }
  },
  "required": ["name", "version", "routes"],
  "oneOf": [
    {
      "required": ["endpoint"]
    },
    {
      "required": ["endpoints"]
    }
  ]
}
